{"format":"org.fieldnote.notebook","version":1,"title":"Fieldnote Demo's field notes","owner":"627a7fe06d1f9d93a0f4c7ed588e0d5b9eea80c9","updatedAt":"2026-09-20T07:03:49.018Z","addressReference":"b624c672831973e1ddcbce3b75f6f18d9dba31febca86d50fd11a966051cdba8","previous":null,"records":[{"id":"d72a11a9-4641-40f4-8b4c-5775379007c9","reference":"273d9eef39c575ef06d2981f12bfa6acbca0ba55dc160f169ec16b3e05da4750","sha256":"5ae667c874ba8f43254c101b3099711b96d15af79ae7f98cc0deef88857bd7d9","bytes":1434}]}