{"format":"org.fieldnote.notebook","version":1,"title":"Fieldnote Demo's field notes","owner":"627a7fe06d1f9d93a0f4c7ed588e0d5b9eea80c9","updatedAt":"2026-09-20T07:06:16.494Z","addressReference":"b624c672831973e1ddcbce3b75f6f18d9dba31febca86d50fd11a966051cdba8","previous":"fee4d68bb07a2484e0c6dd383515964e92d96160a3a7294cd8b74a097abbcc82","records":[{"id":"4ceb0158-ffc2-45b1-8760-53b97cdfa7a6","reference":"e685e2198acc87e7c7a7ba43e73e2ea32fa39b00c48f9d3ab8897277116abef4","sha256":"3cdc49dd96e0789208949bfde4802fe774b5ce0f2f8a9fbf540094150ea4d4e0","bytes":1004},{"id":"d72a11a9-4641-40f4-8b4c-5775379007c9","reference":"273d9eef39c575ef06d2981f12bfa6acbca0ba55dc160f169ec16b3e05da4750","sha256":"5ae667c874ba8f43254c101b3099711b96d15af79ae7f98cc0deef88857bd7d9","bytes":1434}]}